{
  "$schema": "https://json-schema.org/draft/2020-12/schema",
  "$id": "https://github.com/RowanDark/0xgen/plugins/findings.schema.json",
  "title": "Glyph Findings JSONL entry",
  "type": "object",
  "additionalProperties": false,
  "required": ["version", "id", "plugin", "type", "message", "severity", "ts"],
  "properties": {
    "version": {
      "type": "string",
      "const": "0.2",
      "description": "Schema version marker."
    },
    "id": {
      "type": "string",
      "pattern": "^[0-9A-HJKMNP-TV-Z]{26}$",
      "description": "Stable ULID identifier for the finding."
    },
    "plugin": {
      "type": "string",
      "minLength": 1,
      "description": "Identifier of the emitting plugin."
    },
    "type": {
      "type": "string",
      "minLength": 1,
      "description": "Machine readable finding type."
    },
    "message": {
      "type": "string",
      "minLength": 1,
      "description": "Human readable finding summary."
    },
    "target": {
      "type": "string",
      "minLength": 1,
      "description": "Asset or resource that the finding relates to."
    },
    "evidence": {
      "type": "string",
      "minLength": 1,
      "description": "Optional supporting evidence string."
    },
    "severity": {
      "type": "string",
      "enum": ["info", "low", "med", "high", "crit"],
      "description": "Severity level assigned to the finding."
    },
    "ts": {
      "type": "string",
      "format": "date-time",
      "description": "RFC3339 timestamp when the finding was observed."
    },
    "meta": {
      "type": "object",
      "additionalProperties": {
        "type": "string"
      },
      "description": "Optional plugin supplied key/value metadata."
    }
  }
}
